{
  "category": "interface.usb-uart",
  "checks": [],
  "components": [
    {
      "ref": "U1",
      "select": {
        "part": "part:wch-ch340c"
      }
    },
    {
      "ref": "C1",
      "select": {
        "part": "part:kemet-c0603c104k5ractu"
      }
    }
  ],
  "evidence": [
    {
      "page": 2,
      "source": "source:wch-ch340-v3d"
    },
    {
      "page": 3,
      "source": "source:wch-ch340-v3d"
    },
    {
      "page": 4,
      "source": "source:wch-ch340-v3d"
    },
    {
      "page": 5,
      "source": "source:wch-ch340-v3d"
    },
    {
      "page": 9,
      "source": "source:wch-ch340-v3d"
    }
  ],
  "id": "block:usb-uart-bridge",
  "layout": [
    {
      "kind": "PLACE_NEAR",
      "max_distance": {
        "basis": "ENGINEERING_DEFAULT",
        "conditions": {},
        "note": "D32 decoupling placement allowance; validate actual board layout.",
        "unit": "mm",
        "value": 3
      },
      "subject": "C1",
      "target": "U1"
    }
  ],
  "nets": [
    {
      "connect": [
        "port:PWR3V3",
        "U1.pin:16",
        "U1.pin:4",
        "U1.pin:9",
        "U1.pin:10",
        "U1.pin:11",
        "U1.pin:12",
        "C1.pin:1"
      ],
      "name": "PWR3V3"
    },
    {
      "connect": [
        "port:GND",
        "U1.pin:1",
        "U1.pin:15",
        "C1.pin:2"
      ],
      "name": "GND"
    },
    {
      "connect": [
        "port:USB_DP",
        "U1.pin:5"
      ],
      "name": "USB_DP"
    },
    {
      "connect": [
        "port:USB_DN",
        "U1.pin:6"
      ],
      "name": "USB_DN"
    },
    {
      "connect": [
        "port:UART_TX",
        "U1.pin:2"
      ],
      "name": "UART_TX"
    },
    {
      "connect": [
        "port:UART_RX",
        "U1.pin:3"
      ],
      "name": "UART_RX"
    }
  ],
  "parameters": {
    "input_current": {
      "fixed": {
        "basis": "ENGINEERING_DEFAULT",
        "conditions": {},
        "note": "D32 design budget allocation, not a manufacturer over-temperature guarantee.",
        "unit": "A",
        "value": 0.02
      },
      "quantity": "current",
      "required": true
    },
    "input_voltage": {
      "fixed": {
        "basis": "ENGINEERING_DEFAULT",
        "conditions": {},
        "note": "D32: fixed external 3.3 V mode; V3 tied to VCC per datasheet p5.",
        "unit": "V",
        "value": 3.3
      },
      "quantity": "voltage",
      "required": true
    }
  },
  "ports": [
    {
      "kind": "POWER_IN",
      "name": "PWR3V3"
    },
    {
      "kind": "GROUND",
      "name": "GND"
    },
    {
      "kind": "BIDIRECTIONAL",
      "name": "USB_DP"
    },
    {
      "kind": "BIDIRECTIONAL",
      "name": "USB_DN"
    },
    {
      "kind": "OUTPUT",
      "name": "UART_TX"
    },
    {
      "kind": "INPUT",
      "name": "UART_RX",
      "required_function": "UART_TX"
    }
  ],
  "provenance": {
    "created_by": "agent:/root/implement_pcbknowledge_brief/stage6_guards",
    "notes": "Typed UART transmit requirement added by agent:/root/implement_pcbknowledge_brief/g2_mcu_switch_author.",
    "verified_by": [
      "agent:/root/implement_pcbknowledge_brief/g2_source_review"
    ]
  },
  "schema": "pcbknowledge.block.v2",
  "verification": "AGENT_VERIFIED"
}
