{
  "category": "power.switch",
  "checks": [
    {
      "calculator": "mosfet_conduction_loss",
      "inputs": {
        "on_resistance": {
          "bound": "max",
          "component": "Q1",
          "parameter": "resistance"
        },
        "rms_current": {
          "parameter": "output_current"
        }
      },
      "require": {
        "limit": {
          "basis": "ENGINEERING_DEFAULT",
          "conditions": {},
          "note": "Source-condition conduction diagnostic atTA25,VGS2.5V.",
          "unit": "W",
          "value": 0.002
        },
        "operator": "LE",
        "output": "power"
      }
    },
    {
      "calculator": "mosfet_conduction_loss",
      "inputs": {
        "on_resistance": {
          "basis": "ENGINEERING_DEFAULT",
          "conditions": {
            "TJ": {
              "unit": "degC",
              "value": 125
            },
            "gate_voltage": {
              "unit": "V",
              "value": 2.5
            }
          },
          "evidence": {
            "page": 2,
            "source": "source:rohm-rq5e025tntl"
          },
          "note": "D41 uses1.5 times the0.133ohm source maximum at25degC,VGS2.5V for the design up toTJ125degC.",
          "unit": "ohm",
          "value": 0.1995
        },
        "rms_current": {
          "parameter": "output_current"
        }
      },
      "require": {
        "limit": {
          "basis": "ENGINEERING_DEFAULT",
          "conditions": {},
          "note": "D41 operating conduction budget per MOSFET.",
          "unit": "W",
          "value": 0.002
        },
        "operator": "LE",
        "output": "power"
      }
    },
    {
      "calculator": "gpio_drive",
      "inputs": {
        "high_drop": {
          "basis": "DATASHEET",
          "conditions": {
            "TA_max": {
              "unit": "degC",
              "value": 85
            },
            "TA_min": {
              "unit": "degC",
              "value": -40
            },
            "VDD_max": {
              "unit": "V",
              "value": 3.6
            },
            "VDD_min": {
              "unit": "V",
              "value": 2.7
            },
            "output_current": {
              "unit": "A",
              "value": 0.008
            }
          },
          "evidence": {
            "page": 64,
            "source": "source:st-stm32f103"
          },
          "note": "CMOS GPIO VOH >= VDD-0.4V, up to eight sourcing outputs; strict 2.7<VDD<3.6V. C6 normal operating TA from Table9 p38.",
          "unit": "V",
          "value": 0.4
        },
        "high_threshold": {
          "basis": "ENGINEERING_DEFAULT",
          "conditions": {},
          "note": "D41 source RDS(on) gate-voltage condition.",
          "unit": "V",
          "value": 2.5
        },
        "load_current": {
          "basis": "ENGINEERING_DEFAULT",
          "conditions": {},
          "note": "D50 gate-load model allocates100uA,10times the10uA source leakage tested atVGS12V andTA25degC.",
          "unit": "A",
          "value": 0.0001
        },
        "pulldown_resistance": {
          "component": "RP1",
          "parameter": "resistance"
        },
        "series_resistance": {
          "component": "RG1",
          "parameter": "resistance"
        },
        "source_current_rating": {
          "basis": "DATASHEET",
          "conditions": {},
          "evidence": {
            "page": 64,
            "source": "source:st-stm32f103"
          },
          "note": "Current condition for cited CMOS GPIO VOH bound.",
          "unit": "A",
          "value": 0.008
        },
        "supply": {
          "parameter": "input_voltage"
        }
      },
      "require": {
        "limit": {
          "basis": "ENGINEERING_DEFAULT",
          "conditions": {},
          "note": "D41 gate margin after series resistor, pulldown and leakage allocation.",
          "unit": "V",
          "value": 0
        },
        "operator": "GE",
        "output": "high_margin"
      }
    }
  ],
  "components": [
    {
      "ref": "Q1",
      "select": {
        "part": "part:rohm-rq5e025tntl"
      }
    },
    {
      "ref": "D1",
      "select": {
        "part": "part:taiwansemi-ss14"
      }
    },
    {
      "ref": "RG1",
      "select": {
        "part": "part:yageo-rc0603fr-0710rl"
      }
    },
    {
      "ref": "RP1",
      "select": {
        "part": "part:yageo-rc0603fr-0710kl"
      }
    }
  ],
  "evidence": [
    {
      "page": 1,
      "source": "source:rohm-rq5e025tntl"
    },
    {
      "page": 2,
      "source": "source:rohm-rq5e025tntl"
    },
    {
      "page": 7,
      "source": "source:taiwansemi-ss14"
    },
    {
      "page": 64,
      "source": "source:st-stm32f103"
    }
  ],
  "id": "block:g2-low-side-switch",
  "layout": [
    {
      "kind": "GROUP",
      "subjects": [
        "Q1",
        "D1",
        "RG1",
        "RP1"
      ]
    },
    {
      "kind": "PLACE_NEAR",
      "max_distance": {
        "basis": "ENGINEERING_DEFAULT",
        "conditions": {},
        "note": "D40 place flyback diode near the switched load return.",
        "unit": "mm",
        "value": 3
      },
      "subject": "D1",
      "target": "Q1.pin:3"
    }
  ],
  "nets": [
    {
      "connect": [
        "port:GATE",
        "RG1.pin:1"
      ],
      "name": "GATE"
    },
    {
      "connect": [
        "RG1.pin:2",
        "RP1.pin:1",
        "Q1.pin:1"
      ],
      "name": "GATE_BIASED1"
    },
    {
      "connect": [
        "port:RETURN",
        "Q1.pin:3",
        "D1.pin:2"
      ],
      "name": "RETURN"
    },
    {
      "connect": [
        "port:VLOAD",
        "D1.pin:1"
      ],
      "name": "VLOAD"
    },
    {
      "connect": [
        "port:GND",
        "Q1.pin:2",
        "RP1.pin:2"
      ],
      "name": "GND"
    }
  ],
  "parameters": {
    "input_voltage": {
      "quantity": "voltage",
      "required": true
    },
    "output_current": {
      "fixed": {
        "basis": "ENGINEERING_DEFAULT",
        "conditions": {},
        "note": "D35 maximum current PER CHANNEL, including continuous conduction.",
        "unit": "A",
        "value": 0.1
      },
      "quantity": "current",
      "required": true
    }
  },
  "ports": [
    {
      "kind": "POWER_IN",
      "name": "VLOAD"
    },
    {
      "kind": "GROUND",
      "name": "GND"
    },
    {
      "kind": "INPUT",
      "name": "GATE"
    },
    {
      "kind": "POWER_SINK",
      "name": "RETURN"
    }
  ],
  "provenance": {
    "created_by": "agent:/root/implement_pcbknowledge_brief/g2_partial_blocks",
    "notes": "Updated by agent:/root/implement_pcbknowledge_brief/g2_relay_author_d40: D40 separate low-side load sink; D41 hot-resistance model and actual-rail GPIO drive check replace caller-supplied resistance and gate floors. D69: pin anchors; same 3 mm.",
    "verified_by": [
      "agent:/root/implement_pcbknowledge_brief/g2_source_review",
      "agent:/root/implement_reference_layout/placement_review"
    ]
  },
  "schema": "pcbknowledge.block.v2",
  "verification": "AGENT_VERIFIED"
}
