{
  "category": "interface.header",
  "checks": [],
  "components": [
    {
      "ref": "J1",
      "select": {
        "part": "part:wurth-61300411121"
      }
    }
  ],
  "evidence": [
    {
      "page": 1,
      "source": "source:wurth-61300411121"
    },
    {
      "page": 2,
      "source": "source:wurth-61300411121"
    }
  ],
  "external_loads": [
    {
      "connector": "J1",
      "return_pin": "2",
      "supply_pin": "1"
    }
  ],
  "id": "block:g2-load-output-header",
  "layout": [
    {
      "edge": "RIGHT",
      "kind": "EDGE_PLACEMENT",
      "max_distance": {
        "basis": "ENGINEERING_DEFAULT",
        "conditions": {},
        "note": "D47 connector edge access allowance.",
        "unit": "mm",
        "value": 5
      },
      "subject": "J1"
    }
  ],
  "nets": [
    {
      "connect": [
        "port:VLOAD",
        "J1.pin:1"
      ],
      "name": "VLOAD"
    },
    {
      "connect": [
        "port:GND",
        "J1.pin:3",
        "J1.pin:4"
      ],
      "name": "GND"
    },
    {
      "connect": [
        "port:RETURN",
        "J1.pin:2"
      ],
      "name": "RETURN"
    }
  ],
  "parameters": {},
  "ports": [
    {
      "kind": "POWER_IN",
      "name": "VLOAD"
    },
    {
      "kind": "GROUND",
      "name": "GND"
    },
    {
      "kind": "PASSIVE",
      "name": "RETURN"
    }
  ],
  "provenance": {
    "created_by": "agent:/root/implement_pcbknowledge_brief/g2_monitor_author",
    "notes": "D47 external load: pin1 VLOAD, pin2 switched RETURN, pins3/4 ground. Coil/load stays offboard. Contact3 A exceeds500 mA budget; working voltage250 V AC. DC reuse is an engineering selection, not a sourced DC rating.",
    "verified_by": [
      "agent:/root/implement_pcbknowledge_brief/g2_source_review"
    ]
  },
  "schema": "pcbknowledge.block.v2",
  "verification": "AGENT_VERIFIED"
}
