{
  "category": "mechanical.mounting",
  "checks": [],
  "components": [
    {
      "ref": "H1",
      "select": {
        "part": "part:mounting-hole-m3-3v2"
      }
    },
    {
      "ref": "H2",
      "select": {
        "part": "part:mounting-hole-m3-3v2"
      }
    },
    {
      "ref": "H3",
      "select": {
        "part": "part:mounting-hole-m3-3v2"
      }
    },
    {
      "ref": "H4",
      "select": {
        "part": "part:mounting-hole-m3-3v2"
      }
    }
  ],
  "evidence": [],
  "id": "block:mounting-holes",
  "layout": [
    {
      "kind": "KEEPOUT",
      "margin": {
        "basis": "ENGINEERING_DEFAULT",
        "conditions": {},
        "note": "D7: package body envelope is the 6 mm diameter screw-head keepout; do not inflate it further.",
        "unit": "mm",
        "value": 0
      },
      "subject": "H1"
    },
    {
      "kind": "KEEPOUT",
      "margin": {
        "basis": "ENGINEERING_DEFAULT",
        "conditions": {},
        "note": "D7: package body envelope is the 6 mm diameter screw-head keepout; do not inflate it further.",
        "unit": "mm",
        "value": 0
      },
      "subject": "H2"
    },
    {
      "kind": "KEEPOUT",
      "margin": {
        "basis": "ENGINEERING_DEFAULT",
        "conditions": {},
        "note": "D7: package body envelope is the 6 mm diameter screw-head keepout; do not inflate it further.",
        "unit": "mm",
        "value": 0
      },
      "subject": "H3"
    },
    {
      "kind": "KEEPOUT",
      "margin": {
        "basis": "ENGINEERING_DEFAULT",
        "conditions": {},
        "note": "D7: package body envelope is the 6 mm diameter screw-head keepout; do not inflate it further.",
        "unit": "mm",
        "value": 0
      },
      "subject": "H4"
    },
    {
      "distance": {
        "basis": "ENGINEERING_DEFAULT",
        "conditions": {},
        "note": "D7: hole center nominally 3.5 mm from each adjacent board edge.",
        "unit": "mm",
        "value": 3.5
      },
      "edge": "LEFT",
      "kind": "EDGE_DISTANCE",
      "subject": "H1"
    },
    {
      "distance": {
        "basis": "ENGINEERING_DEFAULT",
        "conditions": {},
        "note": "D7: hole center nominally 3.5 mm from each adjacent board edge.",
        "unit": "mm",
        "value": 3.5
      },
      "edge": "TOP",
      "kind": "EDGE_DISTANCE",
      "subject": "H1"
    },
    {
      "distance": {
        "basis": "ENGINEERING_DEFAULT",
        "conditions": {},
        "note": "D7: hole center nominally 3.5 mm from each adjacent board edge.",
        "unit": "mm",
        "value": 3.5
      },
      "edge": "RIGHT",
      "kind": "EDGE_DISTANCE",
      "subject": "H2"
    },
    {
      "distance": {
        "basis": "ENGINEERING_DEFAULT",
        "conditions": {},
        "note": "D7: hole center nominally 3.5 mm from each adjacent board edge.",
        "unit": "mm",
        "value": 3.5
      },
      "edge": "TOP",
      "kind": "EDGE_DISTANCE",
      "subject": "H2"
    },
    {
      "distance": {
        "basis": "ENGINEERING_DEFAULT",
        "conditions": {},
        "note": "D7: hole center nominally 3.5 mm from each adjacent board edge.",
        "unit": "mm",
        "value": 3.5
      },
      "edge": "LEFT",
      "kind": "EDGE_DISTANCE",
      "subject": "H3"
    },
    {
      "distance": {
        "basis": "ENGINEERING_DEFAULT",
        "conditions": {},
        "note": "D7: hole center nominally 3.5 mm from each adjacent board edge.",
        "unit": "mm",
        "value": 3.5
      },
      "edge": "BOTTOM",
      "kind": "EDGE_DISTANCE",
      "subject": "H3"
    },
    {
      "distance": {
        "basis": "ENGINEERING_DEFAULT",
        "conditions": {},
        "note": "D7: hole center nominally 3.5 mm from each adjacent board edge.",
        "unit": "mm",
        "value": 3.5
      },
      "edge": "RIGHT",
      "kind": "EDGE_DISTANCE",
      "subject": "H4"
    },
    {
      "distance": {
        "basis": "ENGINEERING_DEFAULT",
        "conditions": {},
        "note": "D7: hole center nominally 3.5 mm from each adjacent board edge.",
        "unit": "mm",
        "value": 3.5
      },
      "edge": "BOTTOM",
      "kind": "EDGE_DISTANCE",
      "subject": "H4"
    }
  ],
  "nets": [],
  "parameters": {
    "clearance": {
      "fixed": {
        "basis": "ENGINEERING_DEFAULT",
        "conditions": {},
        "note": "Fixed G1 block choice from D7/D9; a different choice requires a reviewed block revision.",
        "unit": "mm",
        "value": 6
      },
      "quantity": "length",
      "required": true
    },
    "drill": {
      "fixed": {
        "basis": "ENGINEERING_DEFAULT",
        "conditions": {},
        "note": "Fixed G1 block choice from D7/D9; a different choice requires a reviewed block revision.",
        "unit": "mm",
        "value": 3.2
      },
      "quantity": "length",
      "required": true
    },
    "length": {
      "fixed": {
        "basis": "ENGINEERING_DEFAULT",
        "conditions": {},
        "note": "Fixed G1 block choice from D7/D9; a different choice requires a reviewed block revision.",
        "unit": "mm",
        "value": 3.5
      },
      "quantity": "length",
      "required": true
    }
  },
  "ports": [],
  "provenance": {
    "created_by": "agent:/root/implement_pcbknowledge_brief/build_g1_blocks",
    "verified_by": [
      "agent:/root/implement_pcbknowledge_brief/implement_footprint_contracts"
    ]
  },
  "schema": "pcbknowledge.block.v2",
  "verification": "AGENT_VERIFIED"
}
